												carbon-silicon carbide																
																												
																												
																												
https://w3id.org/pmd/co/PMD_0000868		natural organic material	material	(material and 'has quality' some 'organic composition')	a naturaly occuring organic materials are materials derived from natural biological sources or processes																							
https://w3id.org/pmd/co/PMD_0090012		biological material	natural organic material		A natural organic material produced by a living organism.					produced through biological synthesis processes like Biological growth, morphogenesis, secretion etc.	"Biological Comosite such as Wood, Bone, Silk, Wool; 
Biopolymers such as cellulose, colagene; 
Biogenic minerals such as hydroxyapatite"	biomaterial																
https://w3id.org/pmd/co/PMD_0090013		biological composite	biological material		a biological material consisting of two or more distinct material phases organized in a multi-scale structure that act synergistically to fulfill specific properties or functions						 such as Wood, Bone, Silk, Wool;																	
https://w3id.org/pmd/co/PMD_0090014		biopolymer	biological material		A natural organic polymer produced by the metabolic processes of a living organism.						such as Polysaccharides like cellulose or Chitin; Proteins like colagene or Fibroin	biomacromoleules																
https://w3id.org/pmd/co/PMD_0090015		mineral (biogenic) 	biological material		An inorganic crystalline or amorphous solid synthesized by a living organism						such as Calcium Carbonates (in shells), Calcium Phosphates (Hydroxyapatite in bone/teeth), or Silica (in diatoms)																	
																												
https://w3id.org/pmd/co/PMD_0090016		bio-based material	natural organic material		An engineered material intentionally processed from materials derived from living (or once-living) organisms					produced through industrial syntesis processes like Chemical extraction, fermentation, or polymerization	"Engineered Biopolymers such as Polylactic Acid (PLA); 
Reconstituted Biopolymers such as Regenerated Cellulose (Rayon/Viscose);
Biocomposites such as Wood-Plastic Composites (WPC); 
Biochemicals (e.g. Bio-based Adhesives)"																	
https://w3id.org/pmd/co/PMD_0090017		engineered biopolymer	bio-based material		A bio-based polymer synthesized through the intentional industrial transformation, synthesis, or reconstitution processes using materials derived from living (or once-living) organisms						synthetic Bio-polymer such as Polylactic Acid (PLA): or Regenrated Biopolymrs like Rayon / Viscose reconstituted from pulp cellulose; or microbial Biopolymers like Polyhydroxyalkanoates (PHA) synthesised by bacteria																	
https://w3id.org/pmd/co/PMD_0090018		bio-based composite	bio-based material		Bio-based composites are engineered composite consisting of at least one constituent derived from biological or bio-based sources						such as Wood-Plastic Composite (WPC), Hemp-fiber reinforced Polypropylene	biocomposite; bio-composite																
https://w3id.org/pmd/co/PMD_0090019		bio-based chemical	bio-based material		A manufactured chemical compound produced from bio-based precursors 						such as bio-based adhesives (e.g. Lignin-based); Bio-epoxy resin.	biochemicals																
																												
																												
https://w3id.org/pmd/co/PMD_0000115		natural inorganic material	material		A naturally occurring inorganic Material formed through geological or biological processes		inorganic composition																					
https://w3id.org/pmd/co/PMD_0020105		mineral (geogenic)		('natural inorganic material' and ('output of' some 'geological process'))	A mineral (geogenic) is a natural inorganic material that is formed through geological processes.						such as Quartz (Silicates) or calcite (Carbonate) or Feldspar (Aluminosilicate)																	
https://w3id.org/pmd/co/PMD_0000114		clay	material		A naturally occurring, fine-grained earthy material composed primarily of hydrous aluminum silicates and other minerals, formed by the geological processes.		inorganic composition		('has part' some (ceramic and 'mineral (geogenic)'))																			
																												
																												
	moved to materials module	biomedical material																										
																												
																												
																												
																												
		Semiconductors																										
https://w3id.org/pmd/co/PMD_0010100		elemental semiconductor		(semiconductor and ('has member' exactly 1 ('portion of pure chemical element' and 'has disposition' some semiconductivity)) )	A semiconductor that shows semiconductive behavior as a pure element.				('has member' exactly 1 'portion of pure chemical element')	Primarily includes group 14 elements like Silicon, Carbon, Germanium, Tin but also Selenium (group 16) and Boron (group 13).	Silicon, Carbon, Germanium, alpha-Tin																	
https://w3id.org/pmd/co/PMD_0010101		compound semiconductor		"(semiconductor
 and ('has member' min 2 'portion of pure chemical element'))"	A semiconductor which is composed of two or more pure elements.						boron nitride (BN), gallium arsenide (GaAs), aluminium gallium arsenide (AlGaAs), indium gallium nitride (InGaN)	alloy semiconductor																
https://w3id.org/pmd/co/PMD_0010102		organic semiconductor	semiconductor		A semiconductor which consists of   organic (carbon based) molecules or polymer.		organic composition		('has part' some ('material' and 'has quality' some 'organic composition'))																			
https://w3id.org/pmd/co/PMD_0010103		hybrid semiconductor	semiconductor		A semiconductor which consists of organic semiconductors and non-organic semiconductors.				"('has part' some 'organic semiconductor')
 and ('has member' some 
    ('compound semiconductor' or 'elemental semiconductor'))"																			
	https://w3id.org/pmd/co/PMD_0010104	gallium arsenide	compound semiconductor		A compound semiconductor which consists of atoms of gallium and arsenic.				('has part' some 'gallium atom' and 'has part' some 'arsenic atom')			activator role																
	https://w3id.org/pmd/co/PMD_0010105	indium phosphide	compound semiconductor		A compound semiconductor which consists of atoms of indium and phosphorus.				('has part' some ('chemical substance' and 'has part' some 'indium atom' and 'has part' some 'phosphorus atom'))																			
	https://w3id.org/pmd/co/PMD_0010106	silicon carbide semiconductor	('silicon carbide ceramic' and ('has disposition' some semiconductivity) and  ('has member' min 2 'portion of pure chemical element'))		A compound semiconductor which consists of silicon carbide.				('has part' some 'silicon atom' and 'has part' some 'carbon atom')																			
	https://w3id.org/pmd/co/PMD_0010107	indium gallium nitride	compound semiconductor		A compound semiconductor which consists of atoms of indium, gallium and nitrogen.				('has part' some 'gallium atom' and 'has part' some 'indium atom' and 'has part' some 'nitrogen atom')																			
	https://w3id.org/pmd/co/PMD_0010108	zinc oxide	compound semiconductor		A compound semiconductor which consists of zinc oxide.																							
	https://w3id.org/pmd/co/PMD_0010109	pentacene	organic semiconductor		An organic semiconductor which consists of pentacene, a polycyclic aromatic hydrocarbon.			http://purl.obolibrary.org/obo/CHEBI_33148																				
	https://w3id.org/pmd/co/PMD_0010110	polythiophene	organic semiconductor		An organic semiconductor which consists of polythiophene, a sulfur heterocycle polymer.			http://purl.obolibrary.org/obo/CHEBI_60616																				
	https://w3id.org/pmd/co/PMD_0010111	fullerene derivative	organic semiconductor		An organic semiconductor which consists of a fullerene derivative.																							
																												
																												
																												
																												
																												
																												
																												
		Comments (first column empty ): 																										
		https://robot.obolibrary.org/template.html																										
																												
		Link to the TSV file of this speadsheet:  																										
		https://docs.google.com/spreadsheets/d/e/2PACX-1vQmflWvRYJEO0K_k9EtLHDTkyIcntG0jW-i9ZNlURUxQET8N9eadI2HdI94hrNMWBcDQAKzE9KWVY6b/pub?gid=0&single=true&output=tsv																										
																												
		Dowload command: 																										
		curl -L "https://docs.google.com/spreadsheets/d/e/2PACX-1vQmflWvRYJEO0K_k9EtLHDTkyIcntG0jW-i9ZNlURUxQET8N9eadI2HdI94hrNMWBcDQAKzE9KWVY6b/pub?gid=0&single=true&output=tsv" > metals.tsv																										
		(you can also copy paste the table to a text file (at least on my macbook))																										
																												
		Robot Command (you need the ontology):																										
		java -jar robot.jar template --input pmdco.owl --template metals.tsv --output metals.ttl																										
																												
																												
																												
																												
																												
																												
																												
																												
																												
																												
																												
																												
																												
																												
																												
																												
																												
																												
																												
																												
																												
																												
																												
																												
																												
																												
																												
																												
																												
																												
																												
																												
																												
																												
																												
																												
																												
																												
																												
																												
																												
																												
																												
																												
																												
																												
																												
																												
																												
																												
																												
																												
																												
																												
																												
																												
																												
																												
																												
																												
																												
																												
																												
																												
																												
																												
																												
																												
																												
																												
																												
																												
																												
																												
																												
																												
																												
																												
																												
																												
																												
																												
																												
																												
																												
																												
																												
																												
																												
																												
																												
																												
																												
																												
																												
																												
																												
																												
																												
																												
																												
																												
																												
																												
																												
																												
																												
																												
																												
																												
																												
																												
																												
																												
																												
																												
																												
																												
																												
																												
																												
																												
																												
																												
																												
																												
																												
																												
																												
																												
																												
																												
																												
																												
																												
																												
																												
																												
																												
																												
																												
																												
																												
																												
																												
																												
																												
																												
																												
																												
																												
																												
																												
																												
																												
																												
																												
																												
																												
																												
																												
																												
																												
																												
																												
																												
																												
																												
																												
																												
																												
																												
																												
																												
																												
																												
																												
																												
																												
																												
																												
																												
																												
																												
																												
																												
																												
																												
																												
																												
																												
																												
																												
																												
																												
																												
																												
																												
																												
																												
																												
																												
																												
																												
																												
																												
																												
																												
																												
																												
																												
																												
																												
																												
																												
																												
																												
																												
																												
																												
																												
																												
																												
																												
																												
																												
																												
																												
																												
																												
																												
																												
																												
																												
																												
																												
																												
																												
																												
																												
																												
																												
																												
																												
																												
																												
																												
																												
																												
																												
																												
																												
																												
																												
																												
																												
																												
																												
																												
																												
																												
																												
																												
																												
																												
																												
																												
																												
																												
																												
																												
																												
																												
																												
																												
																												
																												
																												
																												
																												
																												
																												
																												
																												
																												
																												
																												
																												
																												
																												
																												
																												
																												
																												
																												
																												
																												
																												
																												
																												
																												
																												
																												
																												
																												
																												
																												
																												
																												
																												
																												
																												
																												
																												
																												
																												
																												
																												
																												
																												
																												
																												
																												
																												
																												
																												
																												
																												
																												
																												
																												
																												
																												
																												
																												
																												
																												
																												
																												
																												
																												
																												
																												
																												
																												
																												
																												
																												
																												
																												
																												
																												
																												
																												
																												
																												
																												
																												
																												
																												
																												
																												
																												
																												
																												
																												
																												
																												
																												
																												
																												
																												
																												
																												
																												
																												
																												
																												
																												
																												
																												
																												
																												
																												
																												
																												
																												
																												
																												
																												
																												
																												
																												
																												
																												
																												
																												
																												
																												
																												
																												
																												
																												
																												
																												
																												
																												
																												
																												
																												
																												
																												
																												
																												
																												
																												
																												
																												
																												
																												
																												
																												
																												
																												
																												
																												
																												
																												
																												
																												
																												
																												
																												
																												
																												
																												
																												
																												
																												
																												
																												
																												
																												
																												
																												
																												
																												
																												
																												
																												
																												
																												
																												
																												
																												
																												
																												
																												
																												
																												
																												
																												
																												
																												
																												
																												
																												
																												
																												
																												
																												
																												
																												
																												
																												
																												
																												
																												
																												
																												
																												
																												
																												
																												
																												
																												
																												
																												
																												
																												
																												
																												
																												
																												
																												
																												
																												
																												
																												
																												
																												
																												
																												
																												
																												
																												
																												
																												
																												
																												
																												
																												
																												
																												
																												
																												
																												
																												
																												
																												
																												
																												
																												
																												
																												
																												
																												
																												
																												
																												
																												
																												
																												
																												
																												
																												
																												
																												
																												
																												
																												
																												
																												
																												
																												
																												
																												
																												
																												
																												
																												
																												
																												
																												
																												
																												
																												
																												
																												
