ID 	internal comment	Label	SubClassOf	Equivalent Class	Definition	Disposional 	Quality	Parthood	additional axioms (subclass of)	comment	example	altLabel	futher comment	abbreviation	term tracker annotation													
ID 		AL rdfs:label@en	SC %	EC %	AL skos:definition@en	C 'has disposition' some %	C 'has quality' some %	C 'has part' some  %	C %	A skos:comment	A skos:example	A skos:altLabel	A skos:comment	A abbreviation	A 'term tracker annotation'													
																												
																												
		ID range for this spredsheet is PMD_0010000 - PMD_0011000																										
																												
		NEEDS TO BE ADDED TO PMDco	green==done																									
	moved to qualities module	corrosion resistant																										
	moved to qualities module	hardenable																										
	moved to materials module	portion of rhodium																										
	moved to materials module	portion of tellurium																										
	moved to qualities module	containing magnetic species																										
	moved to qualities module	bioactive																										
	moved to qualities module	bioinert	disposition								non-toxic and non-immunogenic, with little or no bonding or integration with the body.																	
	moved to qualities module	bioresorbable	biocompatible							being absorbed or excreted as it performs its function, often eliminating the need for removal.																		
																												
																												
		fiber	object class		A high-aspect-ratio morphological form of a material characterized by a length significantly greater than its diameter.																							
	moved to qualities module	specific strength	quality							"SI unit for specific strength is Pa⋅m3/kg, or N⋅m/kg, which is dimensionally equivalent to m2/s2, In fiber or textile applications, tenacity is the usual measure of specific strength
"																		
										produced through biological synthesis processes like Biological growth, morphogenesis, secretion etc.	"Biological Comosite such as Wood, Bone, Silk, Wool; 
Biopolymers/Biomacromoleules such as cellulose, colagene; 
Biogenic minerals such as hydroxyapatite"																	
										produced through industrial syntesis processes like Chemical extraction, fermentation, or polymerization	"Engineered Biopolymers such as Polylactic Acid (PLA); 
Reconstituted Biopolymers such as Regenerated Cellulose (Rayon/Viscose);
Biocomposites such as Wood-Plastic Composites (WPC); 
Biochemicals (e.g. Bio-based Adhesives)"																	
																												
	moved to manufacturing module	polymerization	process																									
	moved to manufacturing module	curing	process																									
		crosslinking	process		The formation of chemical bonds (covalent or ionic) that link one polymer chain to another.																							
	imported from chebi	polymerisation monomer	role																									
	imported from chebi	macromolecule	chemical entity																									
	moved to manufacturing module	medical application role	role																									
	imported from chebi	polyurethane macromolecule	chemical entity																									
	moved to manufacturing module	sandwich sheet	role																									
	moved to manufacturing module	sandwich core	role																									
	moved to manufacturing module	laminate ply	role																									
	moved to materials module	geological process	process																									
																												
																												
		dopant role	role		A role of a material that is added to another material in trace amounts to alter electric/optic/structural properties of the doped material.																							
		backbone	role		the longest continuous sequence of covalently bonded atoms within a macromolecular structure that provides the primary structural framework																							
	https://w3id.org/pmd/co/PMD_0010038	side group	role		an atom or group of atoms covalently bonded to the backbone of a polymer chain but not part of the primary structural spine or backbone																							
	https://w3id.org/pmd/co/PMD_0010039	prepolymer	role		A polymer or oligomer whose molecules are capable of entering into further polymerization through reactive groups to reach a higher molecular weight state.																							
	https://w3id.org/pmd/co/PMD_0010041	copolymer	object? chemical entity?		A polymer derived from more than one species of monomer.																							
	https://w3id.org/pmd/co/PMD_0010042	oligomers	object? chemical entity?		A molecular complex that consists of a few monomer units (intermediate between a monomer and a polymer)																							
	https://w3id.org/pmd/co/PMD_0010044	resin	role		A solid or highly viscous substance of plant or synthetic origin that is typically convertible into polymers.																							
	https://w3id.org/pmd/co/PMD_0010045	precursor	role		A compound that participates in a chemical reaction that produces another compound.																							
																												
																												
																												
		METALS																										
https://w3id.org/pmd/co/PMD_0020096		steel	ferrous metal		steel is a ferrous metal that consists of iron and carbon and possibly other alloying elements (and possibly impurities).																							
https://w3id.org/pmd/co/PMD_0010001		carbon steel	ferrous metal		ferrous metal that has a limited amout of carbon			portion of carbon																				
https://w3id.org/pmd/co/PMD_0010003		stainless steel	steel		stainless steel is an iron-based alloy that contains chromium, making it resistant to corrosion (rust).	corrosion resistant																						
https://w3id.org/pmd/co/PMD_0000639		ferrous metal	metal		metal that has iron as primary constituent			portion of iron																				
https://w3id.org/pmd/co/PMD_0010002		cast iron	ferrous metal		ferrous metal that has an amout of min 2.07 wt % carbon 			portion of iron																				
https://w3id.org/pmd/co/PMD_0025004		alloy		(metal and ('has part' some 'alloy crystal'))	a metallic alloy is a mixture of chemical elements of which at least one is a metallic element																							
																												
https://w3id.org/pmd/co/PMD_0010006		chromium steel	steel		chromium steel is the name for any one of a class of non-stainless steels which are used for applications such as bearings, tools, drills and utensils. Such as stainless steel, chromium steels contain chromium, but do not have the corrosion-resistant properties of stainless steel.			portion of chromium																				
https://w3id.org/pmd/co/PMD_0010004		tool steel	steel		steel with tailored mechanical properties	hardenable																						
https://w3id.org/pmd/co/PMD_0010005		alloy steel	steel		alloy steel is steel that is alloyed with a variety of elements in amounts between 1.0% and 50% by weight, typically to improve its mechanical properties.			portion of pure chemical element																				
																												
https://w3id.org/pmd/co/PMD_0010007		non-ferrous metal	metal		non-ferrous metals are metals or alloys that do not contain iron (allotropes of iron, ferrite, and so on) in appreciable amounts.																							
https://w3id.org/pmd/co/PMD_0020186		aluminium alloy	non-ferrous metal		non-ferrous metal consisting primarily of aluminium mixed with other elements 			portion of aluminium	('has part' some 'alloy crystal')																			
https://w3id.org/pmd/co/PMD_0020187		copper alloy	non-ferrous metal		non-ferrous metal consisting primarily of copper combined with other elements			portion of copper	('has part' some 'alloy crystal')																			
https://w3id.org/pmd/co/PMD_0020189		titanium alloy	non-ferrous metal		non-ferrous metal consisting primarily of titanium combined with other elements			portion of titanium	('has part' some 'alloy crystal')																			
https://w3id.org/pmd/co/PMD_0020188		nickel alloy	non-ferrous metal		non-ferrous metal consisting primarily of nickel combined with other elements			portion of nickel	('has part' some 'alloy crystal')																			
https://w3id.org/pmd/co/PMD_0010012		zinc alloy	non-ferrous metal		non-ferrous metal consisting primarily of zinc combined with other elements			portion of zinc	('has part' some 'alloy crystal')																			
																												
https://w3id.org/pmd/co/PMD_0010014		precious metal	metal		metal that are rare, naturally occurring, and have high economic value due to their resistance to corrosion, oxidation, and chemical reaction																							
https://w3id.org/pmd/co/PMD_0010015		gold metal	precious metal		precious metal consisting primarily of gold			portion of gold																				
https://w3id.org/pmd/co/PMD_0010016		silver metal	precious metal		precious metal consisting primarily of silver			portion of silver																				
https://w3id.org/pmd/co/PMD_0010017		platinum metal	precious metal		precious metal consisting primarily of platinum			portion of platinum																				
https://w3id.org/pmd/co/PMD_0010018		palladium metal	precious metal		precious metal consisting primarily of palladium			portion of palladium																				
https://w3id.org/pmd/co/PMD_0010019		rhodium metal	precious metal		precious metal consisting primarily of rhodium			portion of rhodium																				
																												
		POLYMERE																										
																												
https://w3id.org/pmd/co/PMD_0050036		biodegradable polymers		(polymer and ('has disposition' some biodegradability))	Biodegradable polymers are polymers that have the biodegradability disposition. They can be decomposed by biological organisms into environmentally benign substances (carbon dioxide and methane, mineral salts or new biomass) in a non-harmful timescale.										https://github.com/materialdigital/core-ontology/issues/126													
https://w3id.org/pmd/co/PMD_0050004		thermoplastic polymer	polymer		A thermoplastic is a polymer that becomes moldable when heated and solidifies upon cooling.																							
https://w3id.org/pmd/co/PMD_0050005		polyethylene	thermoplastic polymer		poylethylen is a thermoplastic polymer produced by polymerization of the monomer ethylene including further crosslinking and modifications using other comonomers; it excludes ultra hight molecular polyethylen.				('output of' some (polymerization and 'has input' some ('ethylene group' and 'has role' some 'polymerisation monomer')))																			
https://w3id.org/pmd/co/PMD_0050007		high-density polyethylene	polyethylene		High-Density polyethylene is a polyethylene that is characterized by a linear molecular structure and high density.									PE-HD														
https://w3id.org/pmd/co/PMD_0050008		linear low-density polyethylene	polyethylene		Linear low-density polyethylene is a polyethylene that is distinguished by its linear backbone with short-chain branching.									PE_LLD														
https://w3id.org/pmd/co/PMD_0050006		low-density polyethylene	polyethylene		Low-Density polyethylene is a polyethylene that is characterized by a branched molecular structure and low density.									PE-LD														
https://w3id.org/pmd/co/PMD_0050009		polypropylene	thermoplastic polymer		poylpropylene is a thermoplastic polymer produced by polymerization of the monomer propylene including further crosslinking and modifications using other comonomers					this excludes ultra hight molecular polyethylen because very high molecular weight polyethylene is not thermoplastic anymore		polyethene		PP														
https://w3id.org/pmd/co/PMD_0050012		atactic polypropylene	polypropylene		Atactic polypropylene is a polypropylene in which the methyl groups are randomly distributed along the polymer chain.									aPP														
https://w3id.org/pmd/co/PMD_0050010		isotactic polypropylene	polypropylene		Isotactic polypropylene is a polypropylene in which all the methyl groups are aligned on the same side of the polymer chain.									iPP														
https://w3id.org/pmd/co/PMD_0050011		syndiotactic polypropylene	polypropylene		Syndiotactic polypropylene is a polypropylene in which the methyl groups alternate regularly along the polymer chain.									sPP														
https://w3id.org/pmd/co/PMD_0050013		polyvinyl chloride	thermoplastic polymer		polyvinyl chloride is a thermoplastic polymer produced by polymerization of the monomer vinyl chloride.					they are usualy hard or soft and flexible with incrased use of plasticisers.		vinyl or polyvinyl		PVC														
https://w3id.org/pmd/co/PMD_0050015		flexible polyvinyl chloride	polyvinyl chloride		Flexible PVC is a polyvinyl chloride that has been modified with plasticizers to impart flexibility.									fPVC														
https://w3id.org/pmd/co/PMD_0050014		rigid polyvinyl chloride	polyvinyl chloride		Rigid PVC is a polyvinyl chloride that is characterized by its stiffness and durability.									uPVC														
https://w3id.org/pmd/co/PMD_0050016		polystyrene	thermoplastic polymer		Polystyrene is a thermoplastic polymer produced by polymerization of the aromatic hydrocarbon styrene									PS														
https://w3id.org/pmd/co/PMD_0050017		general purpose polystyrene	polystyrene		General purpose polystyrene is a polystyrene that is valued for its clarity and ease of processing.																							
https://w3id.org/pmd/co/PMD_0050018		high impact polystyrene	polystyrene		High impact polystyrene is a polystyrene that is modified with rubber to improve its impact resistance.																							
https://w3id.org/pmd/co/PMD_0050019		polyethylene terephthalate	thermoplastic polymer		Polyethylene terephthalate is a thermoplastic polyester produced by polycondensation of ethylene glycol and terephthalate precursors.								it is the dominant polyester utilized in global packaging and fiber applications	PET														
https://w3id.org/pmd/co/PMD_0050020		amorphous polyethylene terephthalate	polyethylene terephthalate		Amorphous PET is a polyethylene terephthalate that is characterized by a non-crystalline structure.									APET														
https://w3id.org/pmd/co/PMD_0050021		crystalline polyethylene terephthalate	polyethylene terephthalate		Crystalline PET is a polyethylene terephthalate that is distinguished by its ordered, crystalline structure.									CPET														
https://w3id.org/pmd/co/PMD_0050039		polybutylene succinate	thermoplastic polymer		A biodegradable thermolpastic polyester polymer; synthesized via the polycondensation of succinic acid and 1,4-butanediol.	biodegradability																						
https://w3id.org/pmd/co/PMD_0050037		polylactic acid	elastomer		Polylactic acid is a biodegradable polymer produced from renewable resources such as corn starch.																							
https://w3id.org/pmd/co/PMD_0050038		polyhydroxyalkanoates	polymer		polyhydroxyalkanoates are biodegradable polymers that are biosynthesized by microorganisms from sugars or lipids.																							
																												
https://w3id.org/pmd/co/PMD_0050022		thermosetting polymer	polymer		Thermosetting polymer is a polymer that, once cured, irreversibly sets into a permanent shape.				('output of' some curing)																			
https://w3id.org/pmd/co/PMD_0050023		epoxy resin	thermosetting polymer		Epoxy resins are epoxide-functional oligomers curing via ring-opening into crosslinked thermoset networks.							epoxy or polyepoxide	they are utilized for high-performance structural adhesives, composite matrices, and protective coatings.															
https://w3id.org/pmd/co/PMD_0050024		bisphenol a epoxy	epoxy resin		Bisphenol a epoxy is an epoxy resin that is formulated using bisphenol a to enhance its mechanical properties.																							
https://w3id.org/pmd/co/PMD_0050025		novolac epoxy	epoxy resin		Novolac epoxy is an epoxy resin that is based on novolac resins to provide improved thermal and chemical resistance.																							
https://w3id.org/pmd/co/PMD_0050026		phenolic resin	thermosetting polymer		Phenolic resins are thermosetting polymers synthesized via condensation of phenol and formaldehyde					they form rigid, char-forming crosslinked networks		phenol-formaldehyde	they are utilized for flame-resistant adhesives, friction materials, and molded components															
https://w3id.org/pmd/co/PMD_0050027		phenol-formaldehyde resin	phenolic resin		Phenol-Formaldehyde resin is a phenolic resin that is synthesized from phenol and formaldehyde.																							
https://w3id.org/pmd/co/PMD_0050028		melamine formaldehyde	thermosetting polymer		Melamine resin is a thermosetting aminoplast polymer synthesized via condensation					they form hard, durable crosslinked networks.		melamine-formaldehyde	they are widely used in decorative laminates, kitchenware, and coating crosslinkers.															
https://w3id.org/pmd/co/PMD_0090050		thermosetting polyurethane	thermosetting polymer		A thermosetting polymer with carbamate crosslinks.								offers high versatility in mechanical properties	PUR														
https://w3id.org/pmd/co/PMD_0090051		unsaturated polyester resins	thermosetting polymer		Unsaturated polyester resin is a thermosetting polymer system of unsaturated polyester prepolymers in reactive vinyl monomers; it cures by radical crosslinking into rigid networks.								they are used for fiber-reinforced composites															
https://w3id.org/pmd/co/PMD_0050029		urea formaldehyde	thermosetting polymer		Urea formaldehyde is a thermosetting polymer formed from urea and formaldehyde, commonly used in adhesives and molding compounds.																							
https://w3id.org/pmd/co/PMD_0050030		elastomer	polymer		An elastomer is a polymer that exhibits elasticity by returning to its original shape after deformation.																							
https://w3id.org/pmd/co/PMD_0050031		natural rubber	elastomer		Natural rubber is an elastomer polymer, and a biopolymer harvested as plant latex; consisting of cis-1,4-polyisoprene chains; typically sulfur-vulcanized to create crosslinks between chains.					they are predominantly cis-1,4-polyisoprene,			they are used widely in Heavy-duty truck tires															
https://w3id.org/pmd/co/PMD_0050032		synthetic rubber	elastomer		Synthetic rubber is an elastomer that is produced through chemical synthesis to mimic natural rubber’s properties.																							
https://w3id.org/pmd/co/PMD_0050033		styrene-butadiene rubber	synthetic rubber		Styrene–butadiene rubber is a synthetic rubber, and is a family of synthetic random copolymer elastomers of styrene and butadiene, made by emulsion or solution polymerization and typically vulcanized.								used widely for its good abrasion resistance and tunable hardness, for instance in tire treads.															
https://w3id.org/pmd/co/PMD_0090052		silicone rubber	synthetic rubber		Silicone rubber is a synthetic rubber, and is a crosslinked polysiloxane elastomer family, with organic side groups.					it is available in multiple formulations and often filled.	widely used for its broad service temperature range in medical devices, gaskets, and culinary tools		wide service temperature range															
https://w3id.org/pmd/co/PMD_0090053		polychloropren	synthetic rubber		Polychloroprene is a synthetic rubber, and is a family of synthetic elastomeric rubbers; synthesised typically through emulsion polymerization of chloroprene					it offers good weathering and ozone resistance.	 it is widely used in gaskets and wetsuits. 	 Neoprene	weathering resistance; ozone resistance															
https://w3id.org/pmd/co/PMD_0050034		nitrile butadiene rubber	synthetic rubber		nitrile butadiene rubber is a synthetic rubber, and is a family of synthetic acrylonitrile–butadiene copolymer elastomers					it can have tunable polarity and oil/fuel resistance	 it is widely used in oil/fuel resistance applicaitons such as seals, fuel hoses, and protective gloves	Nitrile 	Oil resistance, Fuel resistance															
https://w3id.org/pmd/co/PMD_0050035		ethylene propylene diene monomer	synthetic rubber		Ethylene propylene diene monomer is a synthetic rubber produced from ethylene, propylene, and a diene monomer					it offers excellent weather resistance																		
																												
		GLASS																										
																												
https://w3id.org/pmd/co/PMD_0050149		amorphous metal glass	glass		Amorphous metal glass is glass that is characterized by a disordered, non-crystalline atomic structure, resembling a frozen liquid.																							
https://w3id.org/pmd/co/PMD_0050150		iron-based metallic glass	amorphous metal glass		Iron-based metallic glass is an amorphous metal glass that is predominantly composed of iron.																							
https://w3id.org/pmd/co/PMD_0050151		magnesium-based metallic glass	amorphous metal glass		Magnesium-based metallic glass is an amorphous metal glass that is primarily composed of magnesium, noted for its low density.																							
https://w3id.org/pmd/co/PMD_0050152		zirconium-based metallic glass	amorphous metal glass		Zirconium-based metallic glass is an amorphous metal glass that is composed mainly of zirconium, valued for its corrosion resistance and strength.																							
https://w3id.org/pmd/co/PMD_0050143		bioactive glass		(glass and ('has disposition' some biocompatible))	Bioactive glass is a specialty glass that forms a biologically compatible hydroxycarbonate apatite (HCA) layer on its surface in physiological conditions					enables bonding with bone tissue.																		
https://w3id.org/pmd/co/PMD_0050141		chalcogenide glass	non-silicate glass		Chalcogenide glass is a non‑silicate glass (generally non‑oxide) that contains one or more chalcogens	optical property		chalcogen		Chalcogens such as sulfur, selenium, or tellurium as key constituents. Is valued particularly for infrared transparency.																		
https://w3id.org/pmd/co/PMD_0050123		chemically strengthened glass	glass 		Chemically strengthened glass is a specialty glass that is treated via chemical processes to enhance its strength.				 ('is specified output of' some hardening)																			
https://w3id.org/pmd/co/PMD_0050134		conductive glass		(glass and ('has disposition' some 'electrical conductivity'))	Conductive glass is functional glass that has been modified to exhibit electrical conductivity.																							
https://w3id.org/pmd/co/PMD_0050133		functional glass		('glass' and ('part of' some (object and ('has function' some function))))	Functional glass is advanced glass that is designed to perform specific roles beyond conventional optical applications.					axiom is related to functional material																		
https://w3id.org/pmd/co/PMD_0050128		electrochromic glass	functional glass		Electrochromic glass is a specialty glass that can reversibly change its light transmission properties when an electrical voltage is applied.																							
https://w3id.org/pmd/co/PMD_0050129		photochromic glass	functional glass		Photochromic glass is a specialty glass that alters its optical properties in response to exposure to light.																							
https://w3id.org/pmd/co/PMD_0050130		thermochromic glass	functional glass		Thermochromic glass is a specialty glass that changes its optical properties as a function of temperature.																							
https://w3id.org/pmd/co/PMD_0050124		ion-exchanged glass		(glass and ('is specified output of' some 'ion-exchange hardening'))	Ion-Exchanged glass is a form of chemically strengthened glass that is produced by exchanging ions to improve durability.																							
https://w3id.org/pmd/co/PMD_0050137		magnetic glass		(glass and ('has characteristic' some 'magnetic property'))	Magnetic glass is a specialty glass that exhibits intrinsic bulk magnetic behavior|Magnetic glass is functional glass that is modified to exhibit magnetic properties.					Its composition and/or microstructure contains a significant population of magnetic species - typically transition‑metal or rare‑earth ions and/or magnetic nanophases - so that magnetic susceptibility/permeability/magnetization is a designed functional property of the glass.																		
https://w3id.org/pmd/co/PMD_0050113		non-silicate glass	glass		Non‑silicate glasses are glasses whose primary glass‑forming network is not based on SiO₂					Based on other glass formers or non‑oxide systems (e.g., phosphate (P₂O₅)-based, fluoride-based, or chalcogenide (S/Se/Te)-based compositions).																		
https://w3id.org/pmd/co/PMD_0050115		borate glass	non-silicate glass		Borate glass is a non‑silicate glass based primarily on boron oxide (B₂O₃) as the glass‑forming network			diboron trioxide		It is distinct from borosilicate glass because B₂O₃ is the primary network former here rather than an added co‑former in a silica‑based network.																		
https://w3id.org/pmd/co/PMD_0050148		borate-based bioactive glass	borate glass		Borate-based bioactive glass is a bioactive glass that is formulated with borate compounds to promote biological interaction.	biocompatible																						
https://w3id.org/pmd/co/PMD_0050116		germanate glass	non-silicate glass		Germanate glass is a non-silicate glass that is composed primarily of germanium oxide, noted for its infrared transmission.																							
https://w3id.org/pmd/co/PMD_0050114		phosphate glass	non-silicate glass		Phosphate glass is a non‑silicate glass based primarily on phosphorus pentoxide (P₂O₅) 			tetraphosphorus decaoxide		 (P₂O₅) as the glass former (i.e., replacing SiO₂ as the network basis).																		
